[
  {
    "nome": "Parco Nazionale del Cilento e Vallo di Diano",
    "descrizione": "Parco Nazionale UNESCO. 180.000 ettari di natura e archeologia. Paestum, Velia, grotte, borghi medievali.",
    "lat": 40.2833,
    "lng": 15.1667,
    "source": "hand-written",
    "link": "https://www.parcocesto.it",
    "id": "parco-cilento",
    "difficolta": "",
    "lunghezza_km": null,
    "dislivello_m": null,
    "periodo": "",
    "frequenza": "",
    "tipo": "archeologico",
    "zona": "salerno",
    "citta": "Omignano"
  },
  {
    "nome": "Parco Naturale delle Ferriere",
    "descrizione": "Parco naturale con cascate fino a 60m e sentieri. Valle dei Mulini e antiche cartiere.",
    "lat": 40.6356,
    "lng": 14.6007,
    "source": "hand-written",
    "link": "https://www.parcoamalfi.it",
    "id": "parco-ferriere",
    "difficolta": "",
    "lunghezza_km": null,
    "dislivello_m": null,
    "periodo": "",
    "frequenza": "",
    "tipo": "archeologico",
    "zona": "costiera",
    "citta": "Amalfi"
  },
  {
    "nome": "Riserva Naturale Costiera Amalfitana",
    "descrizione": "Riserva marina e terrestre. Flora e fauna mediterranea. Area marina protetta.",
    "lat": 40.6333,
    "lng": 14.6,
    "source": "hand-written",
    "link": "https://www.parcoamalfi.it",
    "id": "riserva-costiera",
    "difficolta": "",
    "lunghezza_km": null,
    "dislivello_m": null,
    "periodo": "",
    "frequenza": "",
    "tipo": "altro",
    "zona": "costiera",
    "citta": "Amalfi"
  },
  {
    "nome": "Area Marina Protetta Costa degli Infreschi e della Masseta",
    "descrizione": "Area marina protetta nel Cilento. Acque cristalline, grotte sommerse, praterie di posidonia.",
    "lat": 40.033,
    "lng": 15.378,
    "source": "hand-written",
    "link": "https://www.parcocesto.it",
    "id": "area-marina-infreschi",
    "difficolta": "",
    "lunghezza_km": null,
    "dislivello_m": null,
    "periodo": "",
    "frequenza": "",
    "tipo": "spiaggia",
    "zona": "salerno",
    "citta": "San Giovanni a Piro"
  },
  {
    "nome": "Tenuta Castelluccio Gole del Cervati",
    "descrizione": "Punto di interesse nel territorio di Cilento",
    "lat": 40.3490094,
    "lng": 15.3883086,
    "source": "osm",
    "link": "https://www.openstreetmap.org/?mlat=40.3490094&mlon=15.3883086#map=16/40.3490094/15.3883086",
    "id": "parchi-tenuta-castelluccio-gole-del-cervati",
    "difficolta": "",
    "lunghezza_km": null,
    "dislivello_m": null,
    "periodo": "",
    "frequenza": "",
    "tipo": "altro",
    "zona": "cilento",
    "citta": "Piaggine"
  },
  {
    "nome": "Area Marina Protetta Punta Campanella",
    "descrizione": "Punto di interesse nel territorio di Salerno",
    "lat": 40.60293,
    "lng": 14.3890769,
    "source": "osm",
    "link": "https://www.openstreetmap.org/?mlat=40.60293&mlon=14.3890769#map=16/40.60293/14.3890769",
    "id": "parchi-area-marina-protetta-punta-campanella",
    "difficolta": "",
    "lunghezza_km": null,
    "dislivello_m": null,
    "periodo": "",
    "frequenza": "",
    "tipo": "altro",
    "zona": "salerno",
    "citta": "Sorrento"
  },
  {
    "nome": "Area Marina Protetta Santa Maria di Castellabate",
    "descrizione": "Punto di interesse nel territorio di Cilento",
    "lat": 40.2763458,
    "lng": 14.8887679,
    "source": "osm",
    "link": "https://www.openstreetmap.org/?mlat=40.2763458&mlon=14.8887679#map=16/40.2763458/14.8887679",
    "id": "parchi-area-marina-protetta-santa-maria-di-castellabate",
    "difficolta": "",
    "lunghezza_km": null,
    "dislivello_m": null,
    "periodo": "",
    "frequenza": "",
    "tipo": "altro",
    "zona": "cilento",
    "citta": "Castellabate"
  },
  {
    "id": "osm-93496743",
    "nome": "Oasi naturale Valle della Caccia",
    "descrizione": "Punto di interesse nel territorio di Cilento",
    "lat": 40.7228749,
    "lng": 15.1707038,
    "source": "osm",
    "osm_id": 93496743,
    "osm_type": "way",
    "link": "https://www.openstreetmap.org/way/93496743",
    "zona": "salerno",
    "tipo": "altro",
    "citta": "Colliano"
  },
  {
    "id": "osm-116820888",
    "nome": "Riserva naturale dei monti Eremita e Marzano",
    "descrizione": "Punto di interesse nel territorio di Cilento",
    "lat": 40.7555335,
    "lng": 15.3233108,
    "source": "osm",
    "osm_id": 116820888,
    "osm_type": "way",
    "link": "https://www.openstreetmap.org/way/116820888",
    "zona": "salerno",
    "tipo": "altro",
    "citta": "Valva"
  },
  {
    "id": "osm-1330860923",
    "nome": "Oasi Dunale Legambiente",
    "descrizione": "Costruito: 1994",
    "lat": 40.419265,
    "lng": 14.9877727,
    "source": "osm",
    "osm_id": 1330860923,
    "osm_type": "way",
    "link": "https://www.openstreetmap.org/way/1330860923",
    "zona": "cilento",
    "tipo": "altro",
    "citta": "Capaccio Paestum"
  },
  {
    "id": "osm-4100859",
    "nome": "Parco Nazionale Cilento, Vallo di Diano e Alburni",
    "descrizione": "Sito archeologico nel territorio di Cilento",
    "lat": 40.2833541,
    "lng": 15.298374,
    "source": "osm",
    "osm_id": 4100859,
    "osm_type": "relation",
    "link": "https://it.wikipedia.org/wiki/Parco_nazionale_del_Cilento,_Vallo_di_Diano_e_Alburni",
    "zona": "cilento",
    "tipo": "archeologico",
    "citta": "Gioi"
  },
  {
    "id": "osm-4671891",
    "nome": "Riserva naturale Foce Sele Tanagro",
    "descrizione": "Punto di interesse nel territorio di Cilento",
    "lat": 40.5179718,
    "lng": 15.2945939,
    "source": "osm",
    "osm_id": 4671891,
    "osm_type": "relation",
    "link": "https://www.openstreetmap.org/relation/4671891",
    "zona": "cilento",
    "tipo": "altro",
    "citta": "Sant'Angelo a Fasanella"
  }
]